authors	title	year	url	Venue type	Type of framing	Subtype of framing	Language	Grounded?
Frermann et al.	"Conflicts, Villains, Resolutions: Towards models of Narrative Media Framing"	2023	https://aclanthology.org/2023.acl-long.486.pdf	NLP	"Emphasis framing, Narrative framing"	"Generic, Character roles"	English	Grounded
Zou et al.	Crossing the Aisle: Unveiling Partisan and Counter-Partisan Events in News Reporting	2023	https://aclanthology.org/2023.findings-emnlp.45/	NLP	Emphasis framing	Issue-specific	English	Framing analysis
Reiter-Haas	Exploration of Framing Biases in Polarized Online Content Consumption	2023	https://dl.acm.org/doi/abs/10.1145/3543873.3587534	NLP	Narrative framing	Narrative structure	English	Grounded
Syed et al.	Frame-oriented Summarization of Argumentative Discussions	2023	https://aclanthology.org/2023.sigdial-1.10/	NLP	Emphasis framing	Generic	English	Agnostic
Reiter-Haas et al.	FrameFinder: Explorative Multi-Perspective Framing Extraction from News Headlines	2024	https://dl.acm.org/doi/abs/10.1145/3627508.3638308	NLP	"Emphasis framing, Narrative framing"	"Generic, Issue-specific, Narrative structure"	English	Grounded
Nisch	Frames and sentiments of the Twitter communication by German Chancellor Scholz during the Russian invasion of Ukraine	2023	https://sciendo.com/article/10.2478/pce-2023-0028	Political science	Emphasis framing	Issue-specific	English	Agnostic
Stede et al.	Framing climate change in Nature and Science editorials: applications of supervised and unsupervised text categorization	2023	https://link.springer.com/article/10.1007/s42001-023-00199-7	Social science	Emphasis framing	Issue-specific	English	Agnostic
del Barrio & Gatica-Perez	Framing the News: From Human Perception to Large Language Model Inferences	2023	https://dl.acm.org/doi/abs/10.1145/3591106.3592278	NLP	Emphasis framing	Generic	English	Agnostic
Kermani	Framing the Pandemic on Persian Twitter: Gauging Networked Frames by Topic Modeling	2023	https://journals.sagepub.com/doi/abs/10.1177/00027642231207078	Other	Emphasis framing	Issue-specific	Persian	Agnostic
Baumann & Deisenhofer	FramingFreaks at SemEval-2023 Task 3: Detecting the Category and the Framing of Texts as Subword Units with Traditional Machine Learning	2023	https://aclanthology.org/2023.semeval-1.127/	NLP	Emphasis framing	Generic	Multi-lingual	Agnostic
Chebrolu et al.	"Game, Set, and Conflict: Evaluating Conflict and Game Frames in Indian Election News Coverage"	2023	https://arxiv.org/abs/2310.04331	NLP	Narrative framing	Game framing	English	Framing analysis
Koreeda et al.	Hitachi at SemEval-2023 Task 3: Exploring Cross-lingual Multi-task Strategies for Genre and Framing Detection in Online News	2023	https://aclanthology.org/2023.semeval-1.237/	NLP	Emphasis framing	Generic	Multi-lingual	Agnostic
Liao et al.	MarsEclipse at SemEval-2023 Task 3: Multi-lingual and Multi-label Framing Detection with Contrastive Learning	2023	https://aclanthology.org/2023.semeval-1.10/	NLP	Emphasis framing	Generic	Multi-lingual	Agnostic
Reiter-Haas et al.	mCPT at SemEval-2023 Task 3: Multilingual Label-Aware Contrastive Pre-Training of Transformers for Few- and Zero-shot Framing Detection	2023	https://aclanthology.org/2023.semeval-1.130/	NLP	Emphasis framing	Generic	Multi-lingual	Agnostic
Khanchandani et al.	MLModeler5 at SemEval-2023 Task 3: Detecting the Category and the Framing Techniques in Online News in a Multi-lingual Setup	2023	https://aclanthology.org/2023.semeval-1.151/	NLP	Emphasis framing	Generic	Multi-lingual	Agnostic
"Piskorski et al.,"	"Multilingual Multifaceted Understanding of Online News in Terms of Genre, Framing, and Persuasion Techniques"	2023	https://aclanthology.org/2023.acl-long.169/	NLP	Emphasis framing	Generic	"Multi-lingual (English, French, German, Italian, Polish, and Russian)"	Agnostic
Luo et al.	Othering and low prestige framing of immigrant cuisines in US restaurant reviews and large language models	2024	https://ojs.aaai.org/index.php/ICWSM/article/view/31367	NLP	Word choice and labelling	N/A	English	Framing analysis
Rao et al.	Pandemic Culture Wars: Partisan Asymmetries in the Moral Language of COVID-19 Discussions	2023	https://europepmc.org/article/ppr/ppr670240	Other	Emphasis framing	Generic	English	Framing analysis
Khanehzar et al.	Probing Power by Prompting: Harnessing Pre-trained Language Models for Power Connotation Framing	2023	https://aclanthology.org/2023.eacl-main.61/	NLP	Word choice and labelling	N/A	English	Grounded
Hasanain et al.	"QCRI at SemEval-2023 Task 3: News Genre, Framing and Persuasion Techniques Detection Using Multilingual Models"	2023	https://aclanthology.org/2023.semeval-1.172/	NLP	Emphasis framing	Generic	English	Agnostic
Sadeghi et al.	"SinaAI at SemEval-2023 Task 3: A Multilingual Transformer Language Model-based Approach for the Detection of News Genre, Framing and Persuasion Techniques"	2023	https://aclanthology.org/2023.semeval-1.300/	NLP	Emphasis framing	Generic	English	Agnostic
Jiang	"Team QUST at SemEval-2023 Task 3: A Comprehensive Study of Monolingual and Multilingual Approaches for Detecting Online News Genre, Framing and Persuasion Techniques"	2023	https://aclanthology.org/2023.semeval-1.40/	NLP	Emphasis framing	Generic	Multi-lingual	Agnostic
Mohammed Afzal & Nakov	Team TheSyllogist at SemEval-2023 Task 3: Language-Agnostic Framing Detection in Multi-Lingual Online News: A Zero-Shot Transfer Approach	2023	https://aclanthology.org/2023.semeval-1.283/	NLP	Emphasis framing	Generic	Multi-lingual	Agnostic
Pauli et al.	TeamAmpa at SemEval-2023 Task 3: Exploring Multilabel and Multilingual RoBERTa Models for Persuasion and Framing Detection	2023	https://aclanthology.org/2023.semeval-1.117/	NLP	Emphasis framing	Generic	"Multi-lingual (English, French, German, Italian, Polish, and Russian)"	Agnostic
Yu	Towards a More In-Depth Detection of Political Framing	2023	https://aclanthology.org/2023.latechclfl-1.18/	NLP	Narrative framing	Rhetorical	German	Grounded
Pan et al.	"UMUTeam at SemEval-2023 Task 3: Multilingual transformer-based model for detecting the Genre, the Framing, and the Persuasion Techniques in Online News"	2023	https://aclanthology.org/2023.semeval-1.83/	NLP	Emphasis framing	Generic	"Multi-lingual (English, French, German, Italian, Polish, and Russian)"	Agnostic
Pan et al.	Understanding Divergent Framing of the Supreme Court Controversies: Social Media vs. News Outlets	2023	https://ieeexplore.ieee.org/abstract/document/10386532/	NLP	"Emphasis framing, Narrative framing"	"Generic, Episodic vs thematic"	English	Framing analysis
Cuadrado et al.	"UTB-NLP at SemEval-2023 Task 3: Weirdness, Lexical Features for Detecting Categorical Framings, and Persuasion in Online News"	2023	https://aclanthology.org/2023.semeval-1.214/	NLP	Emphasis framing	Generic	English	Agnostic
Reiter-Haas et al.	Framing Analysis of Health-Related Narratives: Conspiracy versus Mainstream Media	2024	https://arxiv.org/abs/2401.10030	NLP	Narrative framing	Narrative structure	English	Grounded
Sharma et al.	"Findings of the CONSTRAINT 2022 Shared Task on detecting the Hero, the Villain, and the Victim in memes"	2022	https://aclanthology.org/2022.constraint-1.1/	NLP	Narrative framing	Character roles	English	Grounded
Odijk et al.	Automatic thematic content analysis: Finding frames in news	2013	https://link.springer.com/chapter/10.1007/978-3-319-03260-3_29	Social science	Emphasis framing	Generic	Dutch	Agnostic
Weinzierl & Harabagiu	"From Hesitancy Framings to Vaccine Hesitancy Profiles: A Journey of Stance, Ontological Commitments and Moral Foundations
"	2022	https://ojs.aaai.org/index.php/ICWSM/article/view/19360	NLP	Emphasis framing	"Generic, Issue-specific"	English	Agnostic
Weinzierl & Harabagiu	"Identification of multimodal stance towards frames of
Communication"	2023	https://aclanthology.org/2023.emnlp-main.776/	NLP	Emphasis framing	Issue-specific	English	Agnostic
Weinzierl & Harabagiu	"Discovering and articulating frames of communication
from social media using chain-of-thought reasoning
"	2024	https://aclanthology.org/2024.eacl-long.97/	NLP	Emphasis framing	Issue-specific	English	Grounded
Kroon et al	Beyond Counting Words	2022	https://www.aup-online.com/content/journals/10.5117/CCR2022.2.006.KROO	Media studies	Emphasis framing	Generic	Dutch	Agnostic
Minnema et al.	Dead or Murdered? Predicting Responsibility Perception in Femicide News Reports	2022	https://aclanthology.org/2022.aacl-main.79/	NLP	Word choice and labelling	N/A	Italian	Grounded